{
  "schema_version": "development-request.v1",
  "request_id": "request-1",
  "intent_ref": "fixture:intent",
  "missing_capability": "fixture:unknown-capability",
  "requested_scope_ref": "fixture:scope",
  "criteria": [
    "missing capability has explicit implementation owner"
  ],
  "context_refs": [],
  "next_action": "RESEARCH",
  "state": "PROPOSED"
}
